{
  "verification_report_id": "00000000-0000-4000-8000-000000000123",
  "schema_version": "1.0.0",
  "outcome": "PASS",
  "reasons": ["Health check command completed successfully."],
  "gate_results": [
    {
      "gate_id": "env_healthcheck",
      "gate_kind": "tests",
      "status": "PASS",
      "detail": "Runtime import and version probe passed.",
      "artifact_ref": "artifact://environment-spec/eng_mdo_uv"
    }
  ],
  "recommended_next_action": "accept_runtime_environment",
  "validated_artifact_refs": ["artifact://environment-spec/eng_mdo_uv"],
  "created_at": "2026-04-08T00:00:00Z"
}
